{
  "task_id": "7806bfe0-a57b-4118-b84f-ebf74c70610f",
  "status": "partial",
  "unmet_criteria": [
    {
      "criterion_id": "426318d8-9ae7-4e2f-b177-c8840a0ba2d3",
      "description": "Tests pass: all relevant tests complete without failure",
      "evidence_quality": "absent",
      "notes": "No test execution events found in trace"
    }
  ],
  "weak_evidence": [],
  "missed_capabilities": [
    {
      "capability_id": "e3fc7e49-538b-465a-8092-b22879f911fb",
      "name": "git_diff",
      "reason": "Criterion 'Tests pass: all relevant tests complete without failure' was not satisfied. 'git_diff' (Show file differences using git diff) was available and tagged for this use case but was not used.",
      "impact": "significant",
      "metadata": {
        "criterion_id": "426318d8-9ae7-4e2f-b177-c8840a0ba2d3"
      }
    }
  ],
  "recommended_repairs": [],
  "evidence_summary": {
    "total_events": 9,
    "successful_events": 9,
    "failed_events": 0,
    "tool_calls": 7,
    "model_calls": 0,
    "file_changes": 1,
    "test_results": 0,
    "capabilities_used": [
      "read_file",
      "pytest_runner",
      "git_create_pr",
      "5f357abf-ab07-4ce2-84cb-23376b8a3757",
      "8f4ba914-e08b-4777-8fd2-d2e444a75901",
      "write_file"
    ],
    "traces": [
      "c98678c4-b026-4c7f-87e4-2ed88a3b8206",
      "1c3f4059-f7ee-48ee-adde-30ec988b4637",
      "c98678c4-b026-4c7f-87e4-2ed88a3b8206-repair"
    ]
  },
  "created_at": "2026-06-10T17:45:59.442872Z"
}